{
  "$schema": "https://json-schema.org/draft/2020-12/schema",
  "$id": "https://openbindings.com/schema/operation-graph-validation-fixture-0.2.0.json",
  "title": "openbindings.operation-graph validation fixture file",
  "description": "Well-formedness fixtures keyed to the stable rule identifiers in the openbindings.operation-graph spec: graph validation rules (OG-V-##), source rules (OG-D-##), and the validation- and version-shaped tool rules (OG-T-##). Each rule block carries `schemaEnforced`, declaring whether the op-graph JSON Schema alone is sufficient to catch violations of that rule; a runner uses it to decide whether to assert schema rejection on the negative cases. Graph-shaped tests carry `graph`; document-shaped tests (the OG-D source rules, which bind OBI content rather than graph definitions) carry `document` instead — an OBI document embedding an operation-graph source/binding.",
  "type": "object",
  "required": ["format", "kind", "rules"],
  "properties": {
    "format": {
      "const": "openbindings.operation-graph@1"
    },
    "kind": {
      "const": "validation"
    },
    "description": {
      "type": "string"
    },
    "notes": {
      "type": "string"
    },
    "rules": {
      "type": "array",
      "minItems": 1,
      "items": {
        "type": "object",
        "required": ["rule", "title", "schemaEnforced", "tests"],
        "properties": {
          "rule": {
            "type": "string",
            "pattern": "^OG-(V-(0[1-9]|1[0-9])|D-0[1-3]|T-0[1-4])$",
            "description": "The stable rule identifier from the format spec: a validation rule (OG-V-##) from its Validation rules section, or a source rule (OG-D-##) / tool rule (OG-T-##) from its Conformance section."
          },
          "title": {
            "type": "string"
          },
          "schemaEnforced": {
            "type": "boolean",
            "description": "True if the op-graph JSON Schema alone rejects every violation of this rule; false if catching it requires a structural validator beyond JSON Schema (reachability, cycle analysis, cross-references), or if the rule is document-shaped or tool-shaped (OG-D/OG-T blocks always declare false: the op-graph schema does not judge OBI documents or tool behavior)."
          },
          "tests": {
            "type": "array",
            "minItems": 1,
            "items": {
              "type": "object",
              "required": ["description", "valid"],
              "oneOf": [
                {
                  "required": ["graph"]
                },
                {
                  "required": ["document"]
                }
              ],
              "properties": {
                "description": {
                  "type": "string"
                },
                "graph": {
                  "type": "object",
                  "description": "An operation graph definition, for graph-shaped rules. valid:true graphs MUST validate against the op-graph JSON Schema (except OG-T-02 refusal-gated acceptance tests skipped by a version gate); valid:false graphs for schemaEnforced rules MUST be rejected by it."
                },
                "document": {
                  "type": "object",
                  "description": "A pre-kind candidate document embedding an operation-graph source and binding, for document-shaped rules (OG-D-##). The named family rule is judged against its source and binding; this fixture makes no current Core-conformance claim."
                },
                "valid": {
                  "type": "boolean",
                  "description": "Whether the graph (or document) satisfies the named rule. For OG-T-02, whether the graph declares exactly the incorporated graph-unit edition 0.2.0 (true) or a version the binding-specification revision refuses (false)."
                },
                "operations": {
                  "type": "array",
                  "items": {
                    "type": "string"
                  },
                  "description": "For OG-V-11 tests only: the operation keys the containing OBI declares. The runner resolves the `operation` field of every operation and each node against this set."
                }
              },
              "additionalProperties": false
            }
          }
        },
        "additionalProperties": false
      }
    }
  },
  "additionalProperties": false
}
